11976	"Andate pure là, tanto quei fessi degli italiani...". Capito perché ci invadono? Il clandestino confessa	1	0
12142	"Che fine spero che faccia il killer nigeriano di Pamela". La furia cieca della Meloni: le sue parole più dure	1	1
12088	"Così i profughi ci svuotano i negozi a Pordenone"	1	1
12030	"Così umiliano gli italiani e coccolano i clandestini". La follia del governo: "Per loro gratis...", e ci invadono	1	1
11775	"Danno soldi ai clandestini, ma ai disabili invece...". Bracconeri, il figlio autistico e il durissimo sfogo a "Libero"	1	1
11630	"Emergenza, Minniti annulla il viaggio e torna in Italia". Immigrati, invasione alle porte: cose mai viste prima	1	1
11695	"Gli immigrati sono matti", parola di scienziati. Malattie mentali e "risorse", lo studio horror	1	1
11866	"Ho chiesto ai profughi di lavorare ma preferiscono non fare nulla"	1	1
12174	"Immigrati bomba sociale Subito via 600mila irregolari"	1	1
11663	"Immigrati, così la sinistra ci costringe a tenerli tutti". Meloni, la denuncia: "Il trucco giuridico per rovinare l'Italia"	1	1
11677	"Immigrati, venite tutti qui". L'ultima "perla" del Papa: con Scalfari tifa invasione	1	1
12092	"Invasi dagli immigrati? Ci resta solo una possibilità". La drastica idea del generale Jean per salvare l'Italia	1	1
12089	"Io al governo? Come ridurrò clandestini e stupratori": Giorgia Meloni, lezione alla sinistra che "ci ha ridotti a schifo"	1	1
11714	"Io, ostaggio degli immigrati: ecco come mi hanno ridotta"	1	1
11808	"Italia serva, calpestata e invasa", adesso basta. Immigrati, Feltri sale sul panzer: "Atto di forza"	1	1
11904	"L'immigrazione indiscriminata porta all'islamizzazione"	1	1
12183	"Macché poveri e disperati. Questi sono falsi profughi"	1	1
12108	"Malaria? E' solo l'inizio...". La tremenda profezia del leghista africano: cosa succederà in Italia	1	1
12023	"Migranti" o "profughi", comunque invasori	1	1
12114	"Perché non voglio immigrati, cosa sarebbe l'Italia senza di loro": Sallusti, una durissima verità	1	0
11853	"Sapete cosa voglio fare agli immigrati violenti?": Don Gigi, il prete giustiziere (anche con l'Islam)	1	1
11742	"Sapete quanti soldi diamo agli immigrati e quanti ai poveri italiani?". Socci svela la vergogna	1	1
11780	Altro che profughi, arrivano clandestini	1	1
11897	Atti osceni davanti ai bambini: il parco di Milano in balìa dei migranti	1	1
11634	Calderoli, la sua soluzione drastica contro gli stupri dei migranti: "Dobbiamo castrarli tutti"	1	1
11618	Ritira la pensione, fa elemosina a una nomade e va al bar: dalle tasche gli spariscono 1000 euro	0	1
11889	Tentano di violentarla mentre va al lavoro: caccia a due stranieri a Grosseto	0	1
11823	Lecco, immigrato fra cacca e pipì tra i mezzi dei vigili: poi le botte all'agente di polizia	0	1
11727	Il cimitero della Parrocchietta nel degrado, circondato da campi rom e discariche	0	1
11903	“Uomini dell’Isis dietro i flussi dei migranti dalla Libia”	0	1
11588	Sea Watch 3 di fronte a Malta, migrante si butta in acqua per disperazione. Trattativa per l'accoglienza	0	0
11685	Di Maio accoglie i migranti della Sea Watch. Scontro con Salvini	0	0
11705	In Edicola sul Fatto Quotidiano del 5 gennaio: Nave dei migranti, Conte e Di Maio scavalcano Salvini	0	0
11901	Lite sui migranti, mossa Di Maio: «Porte aperte a donne e bambini» Gelo Salvini: «Basta ricatti»	0	0
11641	Reddito a 1,4 milioni di famiglie: anche immigrati residenti da 10 anni	0	0
12205	Monfalcone, assessore condivide su Fb filastrocca anti-migranti. Dopo le polemiche dice: "Non è razzismo"	0	0
11804	Di Maio: "Fate sbarcare i migranti di Sea Watch in Italia"	0	0
11589	Monfalcone e Trieste, bufera su assessore e vincesindaco leghista: «Il migrante vien di notte...»	0	0
12154	Bruno Vespa, il retroscena bomba sullo scontro tra Matteo Salvini e Luigi Di Maio per gli immigrati	0	0
12169	Siamo tutti migranti, a Napoli corteo a sostegno dei sindaci che contestano la legge sulla sicurezza - 1 di 1 - Napoli	0	0
11595	Di Maio alla Ue: «Se Malta non fa sbarcare i migranti noi non possiamo prendere i bambini»	0	0
11690	Reddito di cittadinanza, ecco la bozza del decreto: soldi pure agli immigrati	0	0
11777	Napoli, oltre 7mila offerte di aiuto in un giorno per i profughi	0	0
11812	Papa Francesco per i migranti dela Sea Watch: l'appello all'Ue	0	0
12015	Il Papa fa appello all'Europa: "Fate sbarcare i migranti"	0	0
11674	Sea Watch, Nosiglia: "La chiesa torinese pronta ad accogliere i migranti a bordo della nave"	0	0
11651	Sea watch, Lega e M5S si spaccano sui migranti L’appello del Papa ai leader europei	0	0
12006	Sui migranti in mare no di Salvini alla Chiesa: “Fate i vostri appelli ma non entra nessuno”	0	0
12196	Giuseppe Conte, il retroscena su migranti e Sea Watch: "Non solo donne e bambini", bomba su Matteo Salvini	0	0
12013	Conte sul caso migranti: "Diremo sì a 15 persone. Non solo donne e bambini"	0	0
12158	Appello della Sea Watch: “I migranti rifiutano il cibo, dateci un porto”	0	0
11748	Sondaggio Mannheimer, quanti voti portano i sindaci pro-migranti a Matteo Salvini	0	0
11838	L’odissea dei 49 migranti e l’Europa nel guado tra strategie e coscienza	0	0
11830	Ong, Malta non vuole i migranti: "Prima accordo con Ue"	0	0
12073	Carige, migranti, gilet gialli I ribelli M5S contro Di Maio	0	0
12178	Sui migranti è scontro nel governo. Conte: “C’è limite al rigore”. Salvini: “Mai col mio consenso”	0	0
11711	Cacciari urla contro Giulia Bongiorno a Otto e Mezzo per il decreto sui migranti: «Vergognatevi»	0	0
12138	I migranti agitano il governo. Conte contro Salvini	0	0
12241	Sui migranti Conte si smarca e sfida Salvini	0	0
11644	Operazione "Abiad" contro terrorismo, immigrazione clandestina e contrabbando	0	0
11731	Giuseppe Conte vuole prendere gli immigrati della Sea watch, Matteo Salvini: "Niente sbarchi, altrimenti..."	0	0
11910	Sbarcati a Malta i 49 migranti, “poi saranno trasferiti anche in Italia”. Salvini: “Mai dato l’ok”	0	0
11885	I migranti della Sea Watch esultano: sbarcheranno a Malta | Video	0	0
12137	Sea Watch, i volontari annunciano lo sbarco a  Malta. L'urlo di gioia dei migranti: "È finita"	0	0
11888	Foto «rubata» e usata contro i migranti: nuovi guai per il vicesindaco di Trieste	0	0
11920	Malta, lo sbarco dei migranti della Sea Watch e della Sea Eye	0	0
11787	Malta, sbarcati i migranti della Sea Watch e della Sea Eye	0	0
12238	Salvini risponde a Baglioni sui migranti: "Canta che ti passa"	0	0
12093	In Italia 15 migranti sbarcati a Malta. Salvini si oppone: “No a nuovi arrivi”	0	0
11730	Barca a vela si arena nel Crotonese: 51 migranti salvati dai cittadini	0	0
11797	Claudio Baglioni parla di politica e di migranti, e gli hater si scatenano	0	0
12097	Migranti, barca si incaglia in Calabria: 51 profughi salvati dai cittadini	0	0
11591	Crotone, barca a vela con 51 migranti curdi si capovolge vicino alla costa: i cittadini salvano i naufraghi	0	0
11606	Torre Melissa, migranti curdi salvati dal naufragio. Il sindaco: ''Mamme e bimbi bagnati e infreddoliti, siamo corsi ad aiutarli	0	0
11597	Matteo Salvini, la sua linea sugli immigrati era efficace. Ora con Conte e Di Maio riprenderanno gli sbarchi	0	0
11686	I migranti a Crotone salvati dalla gente | Gramellini	0	0
12061	Salvini polemizza con i sindaci: “Decido io”. E prende tempo sull’arrivo dei migranti	0	0
11953	Luca Zaia avverte Matteo Salvini: "Immigrazione, la prova del nove. Occhio al golpe"	0	0
11701	Claudio Baglioni e i migranti, la direttrice di Rai Uno: "Un comizio"	0	0
11881	Crotone, barca naufragata e migranti in mare: gli scafisti se ne vanno in hotel. Arrestati	0	0
11756	Baglioni con i migranti, Al Bano, Eugenio Bennato e Peppino Di Capri con Salvini	0	0
12228	Sala: «Restituirò ai migranti i diritti tolti, da Milano la nuova sinistra»	0	0
11679	Sanremo, Baglioni e i migranti: così la Rai vuole chiudere il caso	0	0
12003	I tanti paradossi sul problema dei migranti	0	0
12134	Baglioni e i migranti/Sanremo, i giochi per l’audience dietro le invettive	0	0
11610	Le parole di Baglioni sui migranti, i pro e i contro	0	0
11673	Traffico di migranti, 14 arresti in Sicilia: sequestrato tesoro di 3 milioni tra ristoranti e cantieri	0	0
12261	Immigrazione clandestina, a Palermo sequestrati beni per tre milioni	0	0
12046	Sequestrato in Sicilia il tesoro degli scafisti: ristoranti, immobili e aziende con  soldi tratta migranti	0	0
12115	Traffico di migranti tra Tunisia e Sicilia: 14 arresti. Sequestrato il tesoro degli scafisti	0	0
11639	Lele Mora rapinato e minacciato a Milano: era al campo rom con 40 mila euro	0	0
11800	Caporalato, centinaia di migranti sfruttati nei campi: arresti a Latina	0	0
11650	Lele Mora, "picchiato e derubato di 40mila euro in campo rom per finto affare". Indagini della procura di Milano	0	0
12070	Caporalato a Latina, migranti 10 ore nei campi a raccogliere kiwi per pochi euro	0	0
12111	Caporalato, centinaia di migranti in “condizioni disumane”: sei arresti a Latina	0	0
11749	Il migrante adolescente morto in mare con la pagella cucita in tasca	0	0
12242	Latina, centinaia di stranieri sfruttati nei campi: arrestati caporali	0	0
12136	Morta Maritsa, la nonna di Lesbo che allattava i migranti	0	0
12059	Al corteo per Matera Capitale della cultura i teli termici dei migranti diventano opere d’arte	0	0
11933	Lele Mora derubato nel campo rom «Mi hanno rapinato perché ingenuo Ora sto lavorando per la tv albanese»	0	0
11861	Giorgia Meloni, fucilata sul reddito di cittadinanza: "Luigi Di Maio regala soldi a immigrati e rom"	0	0
11572	Ma quali guerre, nel 2017 abbiamo fatto sbarcare oltre 128mila individui. Tutti migranti economici	0	0
11974	Gommone con 20 migranti a 50 miglia al largo della Libia, solo tre salvati	0	0
12135	Festival di Sanremo, Claudio Baglioni e il trionfo dei migranti: le canzoni in anteprima, siluro su Salvini	0	0
11678	Libano, tempeste di neve sui campi profughi: 40mila bambini siriani a rischio sopravvivenza	0	0
11926	Lasciano acqua a migranti nel deserto, quattro donne a processo negli Stati Uniti	0	0
12100	Bimba rom di 20 mesi scomparsa nella periferia di Cagliari, i genitori fermati per omicidio	0	0
12240	Sanremo 2019, Salvini-Baglioni, chiarimento dopo la polemica sui migranti	0	0
11994	Fonti del Viminale: chiarimento telefonico tra Salvini e Baglioni sul tema dei migranti	0	0
11801	Bimba rom scomparsa: già a novembre perse le tracce	0	0
12192	Strage migranti, Conte: "Sono scioccato. Mi dedicherò a diritto penale per assicurare scafisti alla giustizia"	0	0
11251	Sea Watch, l'ultima presa in giro degli immigrati all'Italia: i minori nati tutti lo stesso giorno	1	1
11318	Sanremo 2019, don Salvatore Picca il prete pro-Salvini massacra il festival: "Vinci se sei musulmano e drogato"	1	1
11412	Sanremo, prete contro Mahmood: "Ha vinto un immigrato con i tatuaggi…"	1	1
11488	Matteo Salvini, bomba a urne aperte in Sardegna: "Volete più immigrati? Votate Pd"	1	0
11114	Le spese pazze del governo Oltre 23mila euro per i rom	1	1
10853	Ecco il reddito di cittadinanza Pacchia per immigrati e rom	1	1
11266	I migranti vogliono il sussidio. In arrivo una pioggia di ricorsi	1	1
11549	Falsi attestati a 6mila immigrati: permessi di soggiorno in regalo	1	1
11491	Il regno di immigrati e no global: "Ecco l'anticamera dell'inferno"	1	1
11443	Clandestini, i pm disfa-leggi a scuola di ostruzionismo	1	0
11040	Clandestini, la retromarcia della Cassazione: &quot;Vanno espulsi anche se i figli vanno a scuola&quot;	1	1
11171	Classe solo di bimbi immigrati: a Padova "spariscono" gli italiani	1	1
11474	Come ci si sbarazza degli immigrati africani: ecco la durissima lezione di Israele all'Italia	1	0
10860	Come rimanere clandestini a norma di legge	1	1
11513	Come ti addomestico il clandestino	1	1
11487	Con Appendino Torino mecca dei musulmani	1	1
11062	Cona, profughi molestano una 17enne	1	1
10826	Cosa succede in questo residence per immigrati? Piscina, festini, droga e sesso: i dettagli-scandalo	1	1
11316	Così gli immigrati sostituiscono e umiliano Gesù. La denuncia di Socci: il volantino-vergogna / Foto	1	1
11280	Così il governo Renzi regala ​la cittadinanza agli immigrati	1	0
11214	Così l'elemosina finanzia il racket dei clandestini	1	0
11308	Così Renzi si è venduto l'Italia. Immigrati, parla l'ex ministro: "In cambio di soldi...", suicidio	1	0
10966	Cure a costo zero anche per i clandestini	1	1
11199	Da "clandestini" a "zingaro" le parole vietate per sentenza	1	1
11172	Dà la casa ai profughi. E gli italiani?	1	1
11007	Dopo aver tagliato ai disabili, Renzi regala un miliardo ai richiedenti asilo	1	1
11360	Dopo lo spottone pro-immigrazione, Favino da non credere: fino a dove si spinge sul monologo a Sanremo	1	0
10914	E Minniti apre il "corridoio elettorale". I primi 160 profughi arrivano in aereo	1	1
10934	È reato dire "clandestino"	1	0
11345	Ecco chi ci porta i profughi a domicilio. Chi sono e cosa fanno nel Mediterraneo	1	1
11144	Ecco come l'immigrazione ha ucciso il turismo a Fiuggi	1	1
10828	Ecco come rovinano l'Italia: immigrati, scippi e rapine? Le cifre-verità sulle "risorse"	1	1
11054	Ecco il sito che indica le rotte. Toh il trucchetto dei migranti: l'invenzione è di due italiane	1	1
10949	Ecco la notizia più attesa. Immigrati, il dato pazzesco: in Italia adesso cambia tutto?	1	0
10958	Ecco le bugie dei clandestini per ottenere asilo	1	1
11033	Ecco perché i migranti saranno sempre di più e l'Italia perde la loro parte migliore	1	0
10918	Emma Bonino è fuori, delirio sugli immigrati: "Senza di loro...". Mai sentito prima: fino a dove si spinge	1	0
11191	Eraclea, profughi protestano per il cibo e lo buttano in strada	1	1
11344	Ergastolo al somalo-bestia: cosa faceva ai profughi, come ha reagito col giudice	1	1
11161	Esuli, clandestini e rom &quot;Tutte le emergenze le scaricano su Milano&quot;	1	1
11017	Evviva Papa Francesco, ma non i clandestini	1	1
11390	Expo: Bordonali, richiedenti asilo in campo base simbolo fallimento governo	1	0
11052	Facci contro gli immigrati: "Ci stanno sostituendo. Basta balle: ecco cosa sono"	1	1
11165	Fascisti? No, islamici integrati. La figlia vive "all'occidentale", come l'hanno brutalizzata	1	1
10886	Ferrara, aggredita e pestata da cinque immigrati	1	1
11234	Ferrara, il sindaco leghista: "Denuncia chi ospita i migranti di nascosto"	1	0
11278	Fini sbugiardato: ecco tutti gli hotel che ospitano profughi	1	1
10989	Follia del Tar: vietato espellere i clandestini spacciatori	1	1
10992	Follia europea: accoglieremo pure i "profughi climatici"	1	1
11088	Fontana: "Se sarò eletto farò espellere 100mila clandestini dalla Lombardia"	1	1
10884	Furbi e incoerenti: bombe umanitarie, ma niente clandestini	1	1
11470	Furia Cruciani: clandestini farabutti devastano un traghetto	1	0
11228	Gabanelli bombardiera: "Ecco cosa fare coi migranti". Così asfalta Boldrini, Kyenge e le altre "verginelle"	1	1
11291	Giorgia Meloni, una sonora lezione a Madame Boldrini: "Vergogna, ai profughi case e diritti. Italiani umiliati..."	1	1
11270	Giornalismo in salsa Boldrini: censurata la parola "clandestini"	1	1
10812	Gli 007 rivelano: se i profughi migrano è colpa del loro smartphone	1	1
11335	Gli immigrati ci invadono e paghiamo per portarli da noi. Così beffano i nostri militari	1	1
10950	Gli immigrati coprono Cristo di escrementi. L'orrore in Liguria: ecco il loro water / Foto	1	1
10976	Gli immigrati fanno perdere all'Italia 5 miliardi l'anno	1	1
11154	Gli immigrati godono, gli italiani si infuriano: lo Stato regala a loro una "umile" dimora / Foto	1	1
11334	Gli immigrati in Italia, cosa rischiano le donne. È la Bongiorno l'anti-Boldrini: la scomoda verità	1	1
10862	Gli intoccabili clandestini –	1	1
10834	Gli italiani servi degli immigrati L'ultima vergogna: cosa gli paghiamo	1	1
10925	Grosseto, migranti a lavoro nell'area archeologica ma il sindaco dice no: "Prima vengano altri"	1	1
11229	I clandestini occupano il villaggio olimpico di Torino. E Fassino non dice nulla	1	1
11232	I clandestini restano in Italia anche dopo essere espulsi	1	1
10824	I clandestini sputano sull'Italia: "Vi odiamo: non ci date niente"	1	0
10887	I clandestini? Fermiamoli prima che sbarchino	1	1
11210	I dieci sindaci che rifiutano i clandestini e vengono denunciati	1	0
10875	I dubbi sui profughi che lasciano le donne: "Come mai le abbandonano in guerra?"	1	1
11146	I pusher richiedenti asilo col portafogli colmo di soldi	1	1
11226	I ragazzini profughi africani? Sequestrano un uomo poi... Terrore nella casa famiglia	1	1
10854	Idomeni, sgomberata la "giungla" del più grande campo profughi d'Europa	1	1
10895	Il 66% degli italiani è contro gli immigrati	1	0
10917	Il boom di ricorsi dei furbetti che chiedono asilo	1	1
10839	Il cartello del sindaco. Paese invaso da immigrati? E lui li umilia così / Guarda	1	1
11312	Il documento cancella metà Italia. Sarà l'estinzione, addio in 50 anni: quanti saranno gli immigrati	1	1
11350	Il giudice si arrende: "Il clandestino ci crede un Paese senza regole"	1	1
10900	Il governo pensa a banche e clandestini. Il dovere di dire "prima i terremotati"	1	1
11358	Franco Bechis: Pensano ai migranti e dimenticano i terremotati di Amatrice	0	1
11090	Per i quarant’anni della Rivoluzione islamica l’Iran testa il missile che può colpire l’Europa	0	1
10921	Matteo Salvini, il video in cui l'immigrato ammette di essere un migrante economico: "Ringraziate il Pd"	0	1
11084	Accoltellati per una parola di troppo davanti a un locale: gravi due 23enni, fermati tre nomadi	0	1
10959	Calci e pugni alle auto parcheggiate in strada: arrestati due immigrati	0	1
11555	8 marzo, volantino maschilista. Segretario Lega Crotone: "Se tocchi donne, gay e migranti è l'inferno"	0	1
11340	Rogo tossico dal campo nomadi di Castel Romano, a Pomezia residenti barricati in casa	0	1
11378	Basilicata, Salvini sbeffeggia oppositore: "Avrai la gioia di mantenere a vita dieci bei migranti"	0	1
11540	Matera, Salvini contestato durante il comizio. E lui risponde: "Bravi, avete vinto dieci immigrati da mantenere"	0	1
11276	Brucia il campo nomadi a Monti Tiburtini. La paura dei residenti: "L'avevamo detto"	0	1
11281	Torino, ragazza violentata da un migrante nel parco dopo la discoteca	0	1
11271	A Lampedusa due sbarchi di migranti in 24 ore con il trucco della «nave madre»	0	1
11091	Roma, vince la rivolta dei cittadini contro i rom: Virginia Raggi si arrende, dove "piazza" i nomadi	0	1
10818	Dramma-Striscia la Notizia, la mossa tragica di Brumotti: aggredito da dieci immigrati, finisce malissimo	0	1
10835	Falsi permessi di soggiorno: tutti assolti gli immigrati coinvolti	0	1
10923	Farmaci: 4000 vaccini tifo e 1000 test Tbc a centro richiedenti asilo Sicilia (2)	0	1
10941	Finanzia l'invasione degli immigrati: ecco la prova. La vergogna di George Soros, "padrone" d'Italia	0	1
11287	Formaggi, olio, pomodori e vino: il lavoro degli immigrati che mantiene vive le nostre campagne	0	1
10891	Germania, boom di immigrati italiani	0	1
11024	I migranti della Sea Watch in sette Paesi Salvini: "Missione compiuta"	0	0
11457	Sea Watch questa mattina a Catania, ok da 6 Paesi per accogliere i migranti	0	0
11400	#fateliscendere, a Bari il flash mob al Fortino per i migranti della Sea Watch	0	0
11059	Le periferie, i migranti e il bisogno di sicurezza	0	0
11469	A Catania i 47 migranti della Sea Watch: “Saranno accolti in sette Stati europei”	0	0
11086	Sea Watch, lo sbarco a Catania: festa tra gli immigrati, parte il circo contro Matteo Salvini	0	0
11439	Sea Watch a Catania, applausi per ogni migrante che scende dalla nave	0	0
10998	Di Maio e gli 8 pannelli sui risultati del Governo: "Non si può parlare solo di immigrazione"	0	0
11177	Emirati Arabi, il vescovo Hinder: “Così cristiani e musulmani aspettano il Papa”	0	0
11050	Montalbano, i nuovi episodi tra migranti e vecchie storie del '43	0	0
11207	Montalbano salva i migranti, caos in Rai sul commissario	0	0
11471	Studentessa picchiata dall'ex, a Bari presidio di solidarietà: "Per le migranti tutto più difficile"	0	0
11018	Palermo, Leoluca Orlando iscrive all'anagrafe quattro stranieri: "Obbligo del sindaco è rispettare la Costituzione"	0	0
11321	Salvini contestato a Giulianova: "Assassino di m...". E lui replica: "Hai vinto dieci immigrati a casa tua"	0	0
11204	Diciotti e Sea Watch, Matteo Salvini e il sondaggio-plebiscito sui migranti. Suicidio Pd: "Il processo..."	0	0
11466	Auto pirata uccide due migranti in bicicletta a Villa Literno	0	0
11477	Qualcuno urla 'assassino' a Salvini. E il vicepremier risponde: "Hai vinto dieci immigrati a casa tua"	0	0
11129	Caserta, immigrati in bici travolti e uccisi da auto:  preso il pirata. «Ho sentito urto, ma  non avevo capito»	0	0
10916	Sanremo 2019, la domanda sugli immigrati fa sbroccare Claudio Bisio in conferenza stampa	0	0
11217	Lo dico al Corriere - Perché i migranti africani continuano a partire	0	0
11379	Sanremo 2019, Pio e Amedeo contro Matteo Salvini sugli immigrati: il ministro risponde	0	0
11348	Gad Lerner e il dossier che inchioda la sinistra: armi, immigrati e navi. Altroché Diciotti	0	0
10808	Cara Mineo, partiti sul bus i primi 25 migranti che verranno trasferiti	0	0
11038	Cerca di varcare confine: giovane migrante muore assiderato tra l'Italia e la Francia	0	0
11076	Crollano le nascite (-9%), sempre meno italiani: stranieri oltre i cinque milioni	0	0
10962	Sesto San Giovanni, bando anti-stranieri per le case popolari: solo due assegnazioni su 39 nella ex Stalingrado d'Italia	0	0
11149	Sea Watch, Viminale: "Dietrofront di Parigi, non prende migranti economici. Promettono di aiutarci a rimpatriarli"	0	0
10964	Sea Watch, vendetta di Macron sui migranti: "La Francia non li prende più". Salvini lo frega: "Allora..."	0	0
11445	Sea Watch, il Viminale: “La Francia non vuole più i migranti”	0	0
11071	Il Papa riceve l'Anm: vuoti legislativi su vita, famiglia e migranti	0	0
10990	Bari, incendio al Cara: i migranti aiutano a spegnere le fiamme	0	0
11465	Teologi cattolici e musulmani alleati per costruire coesione	0	0
11286	Polemica su Montalbano: “Fa propaganda pro migranti”. Il web si divide e twitta anche Salvini	0	0
10955	Luigi Patronaggio, il pm anti-Salvini chiama a lavorare in procura sei immigrati	0	0
11077	Una tuta con il velo per convincere le studentesse musulmane a fare sport: l'idea di un ateneo inglese	0	0
11060	A Ormea i migranti salvano i castagneti, ma forse il Decreto Sicurezza li farà andare via	0	0
11200	Polizia francese spruzza spray sul treno per stanare i migranti dalla toilette	0	0
10995	Emmanuel Macron, la Francia stana immigrati con lo spray urticante: ha ancora il coraggio di farci la morale?	0	0
10848	Simone Cristicchi: “Canto per non dimenticare i profughi istriani”	0	0
10813	Rogo San Ferdinando: disperazione rabbia e rassegnazione tra i migranti dopo l'incendio	0	0
11455	Premio a "La paranza dei bambini".  Il solito Saviano: lo dedica a Ong e migranti	0	0
10984	Tiziano Renzi ai domiciliari, la finta coop per guadagnare di più e quei pagamenti fantasma agli immigrati	0	0
10885	Pure l'Antitrust contro Matteo Salvini: "No alla tassa sulle rimesse degli immigrati"	0	0
11458	Emozione a Ceraso, 13 piccoli migranti diventano cittadini onorari. Don Ciotti: "Altri Comuni seguano l'esempio"	0	0
11370	E adesso la Spagna buonista rimanda i migranti in Marocco	0	0
10977	Diciotti: migranti costretti a restare a bordo chiedono un risarcimento all’Italia	0	0
11045	Diciotti, 41 migranti chiedono i danni a Salvini	0	0
11249	Nave Diciotti, migranti chiedono risarcimento a Salvini e Conte	0	0
11454	I migranti della Diciotti fanno causa: "Adesso Salvini ci paghi i danni"	0	0
10800	Costretti a rimanere sulla Diciotti. Ora i migranti vogliono il risarcimento	0	0
11298	Diciotti, legale dei migranti: "Salvini ha responsabilità e ride? Pensa di stare a Masterchef o al Viminale?"	0	0
10919	«Attentato del cantante gay islamico» Una fiction fa litigare Francia e Israele	0	0
10974	Accusa bimbo rom di furto e lo ferisce con una lama: arrestato	0	0
11186	I volontari francesi: in un anno 30 migranti morti nel tentativo di attraversare le Alpi	0	0
11492	Immigrazione, la Sea Watch lascia Catania e parte per Marsiglia	0	0
11302	Aggredisce bambino rom con un taglierino a Termini: «Stavi rubando». Arrestato un 29enne	0	0
11447	Giorgia Meloni contro Fabio Fazio: "Guadagni milioni e ci fai lezioni sui migranti?"	0	0
11141	Camilleri e i migranti in Montalbano: «Era cronaca di un anno fa, allora avevamo più cuore»	0	0
11533	Francia, Decathlon cede a proteste e minacce. Ritirato il velo islamico da corsa	0	0
11205	Le toghe rosse contro Salvini: così difendono Ong e migranti	0	0
11203	Emmanuel Macron, l'orrore "vomitevole" della Francia sui migranti: i giudici lo asfaltano	0	0
10957	Venezia, ritrae Salvini con un bimbo migrante in braccio. La Digos arriva e filma tutto	0	0
11383	PiazzaPulita, Paragone scatenato contro Corrado Formigli: "Guardatelo in faccia quando parla di immigrati"	0	0
11155	Macron: “Sui migranti l’Europa Ã¨ responsabile, a Italia fardello troppo pesante”	0	0
11008	Carro con i migranti e scritte "no pago affitto": bufera sul carnevale di Formello	0	0
11376	Tu non sei razzista, sei str.... La donna che difese uno straniero, a Napoli, premiata da Mattarella	0	0
11437	Mattarella premia Maria Rosaria Coppola, la donna che difese un immigrato in treno a Napoli	0	0
11354	San Ferdinando, tendopoli militarizzata. I migranti: "Noi siamo qui per lavorare"	0	0
11395	Blitz di 600 agenti al ghetto di San Ferdinando: Salvini sgombera i migranti	0	0
10898	Alessandra Ghisleri a L'aria che tira, lezione ai compagni: che roba è stato il corteo pro-immigrati di Milano	0	0
11293	Nave militare italiana dichiara un’avaria, Malta va a salvare 87 migranti a sud di Lampedusa	0	0
