11222	Presentato il Festival della salute globale: a Padova si discuterà di medicina, disuguaglianze, migrazioni	0	0
11061	Soccorsi al largo di Lampedusa quaranta migranti, tra loro donne e bambine	0	0
11201	Bruxelles, ministri dell'Interno Ue discutono di migranti. Ma Salvini è a Potenza per la campagna elettorale	0	0
10859	8 marzo a Milano, le donne in sciopero con Lgbt e migranti: "Uniti nella comunità ideale"	0	0
11009	Festa della donna, a Bari la Cgil raccoglie le storie delle lavoratrici migranti	0	0
10937	Razzismo, il pregiudizio verso i migranti non si disinnesca con le aberrazioni buoniste	0	0
11468	Portate migranti in Francia: e Macron fa arrestare due autisti italiani	0	0
11145	Flixbus, autisti ammanettati e chiusi in celle separate dalla polizia francese: «Portate migranti in Francia»	0	0
11382	Croazia, migranti costretti a pronunciare il saluto filonazista	0	0
11325	Immigrazione, le cifre del trionfo di Matteo Salvini: sbarchi ai minimi da nove anni a questa parte	0	0
11002	“I musulmani ci invadono”. La strage nelle moschee trasmessa in diretta web	0	0
11056	Book Pride, il medico che dà un nome ai migranti annegati: ''Gli oggetti recuperati dalle loro tasche li rendono simili a...	0	0
11527	Strage Christchurch, la premier Ardern abbraccia la comunità musulmana	0	0
10226	Marco Bussetti: “A scuola tuteliamo gli studenti immigrati ma prima i nostri figli”	1	0
10649	Ancora migranti a Lampedusa. Salvini: "Li rispediamo a casa loro"	1	0
10029	C’è la scuola, via i migranti: “Siamo contrari all’apartheid ma ora serve più sicurezza”	1	1
10586	«I rom non sono uguali a noi». E lo studio di Piazza Pulita applaude il giovane ospite	1	1
10687	Paura nel campo nomadi: giornalista aggredita e derubata	1	1
10472	Libia, l’appello del premier Sarraj: «Fate presto, 800mila tra libici, migranti (e molti terroristi) pronti a invadere l’Italia e l’Europa»	1	1
10129	L'allarme di al-Serraj all'Italia: "800mila migranti pronti a invadervi"	1	1
10546	In balia di 800mila profughi (e dei pm)	1	0
10208	Milano, Sala coccola gli immigrati e loro gli occupano lo stabile	1	1
10363	Un pm aveva appena liberato l'immigrato che ha attaccato gli agenti a Torino	1	1
10680	Milano, rom in villetta col reddito M5S: "E lavoriamo in nero"	1	1
10285	Carpi, aggressione ad una coppia di fidanzati. Fermati tre stranieri	1	1
10305	Salvini: «Il calcio? Rimpiango i tre stranieri in campo»	1	0
10763	Viterbo, i post del consigliere di Casapound Francesco Chiricozzi: "Lo straniero stupra di più dell'italiano"	1	1
10361	Reddito, agli stranieri 60mila card ma i controlli solo a ottobre	1	1
10313	I dipinti offendono i musulmani. E il museo li copre - La Verità	1	1
10658	Roma, casa popolare a una famiglia di nomadi. Tensione a Casal Bruciato: "Non ve ce volemo qua!"	1	0
10037	L'auto dei rom di Casal Bruciato? Targa falsa e senza assicurazione	1	1
10098	Casa popolare ai rom anche a Casal de' Pazzi. Residenti sul piede di guerra	1	0
10798	Anziana uccisa dopo la rapina, fermata la banda di ladri rom	1	1
10312	​Anziana morta dopo rapina a Montesacro, Salvini: «I cinque rom vanno espulsi»	1	0
10444	Il rom che ha ucciso l'anziana: sfilza di reati e un'espulsione	1	1
10797	Così il Tar si piega ai buonisti e non espelle più l'immigrato	1	0
10366	Il cardinale Müller: "non possiamo pregare come o con i musulmani"	1	0
10513	Il rogo del migrante con sette identità: brucia una casa e uccide due donne	1	1
10584	Rivolta a Torpignattara: "Via stranieri e moschee"	1	0
10695	Degrado Val Melaina, rissa a bottigliate tra rom in pieno giorno	1	1
10182	Anziana rapinata sull'autobus, i due nomadi in fuga si rifugiano al campo di via Candoni	1	1
10180	Trump apre il fronte messicano: “Via i migranti o metto i dazi”	1	0
10223	Bologna, Salvini contro i vertici di pediatria del Sant’Orsola: «Gli immigrati? Record di Tbc e scabbia» 	1	1
10280	Il governo regala il nostro 8 per mille ai profughi	1	1
10374	Il manifesto per gli immigrati: ​"Se sei venuto per delinquere faremo di tutto per cacciarti"	1	1
10315	Il Paese (vicino a noi) dice basta: "Troppi". Porte chiuse agli immigrati	1	1
10784	Il paese invaso dai migranti: 113 profughi con 110 abitanti	1	1
10576	Il parroco anti-immigrazione: ​"Non possiamo farci calpestare"	1	1
10097	Il piano degli islamici italiani: due milioni di profughi	1	1
10502	Il piano del Viminale: integrare i profughi? Ora tocca pure alle Regioni	1	0
10275	Il piano per fermare l'ondata di clandestini: 10mila rimpatri al mese	1	1
10488	Il sindaco anti-immigrati, una rivoluzione nel Pd: "Come ripulisco tutto"	1	1
10218	Il terrore viene da fuori. Sono immigrati l'84% degli attentatori	1	1
10437	Il traffico degli appartamenti: ai clandestini nozze e un tetto	1	1
10664	Il Viminale assume (solo per gli immigrati)	1	1
10385	Immigrati a Roma, è allarme stupro	1	1
10522	Immigrati e malattie, toh... Record horror tra i profughi, i 50 casi da brividi (in Italia)	1	1
10146	Immigrati, ammiraglio brutale: ora basta balle. "Ecco chi trama contro l'Italia, serve una guerra"	1	1
10537	Immigrati, ci invadono e loro intascano 100 milioni. La lista delle vergogna: le 15 coop rosse più potenti	1	1
10644	Immigrati, ecco il trucco-truffa sulle pensioni: come si pappano l'assegno senza versare nulla	1	1
10390	Immigrati, gli avvocati che annullano le espulsioni? Toh, che caso: maxi-scandalo, chi c'è dietro di loro	1	1
10639	Immigrati, la verità nascosta. "Sapete cosa stanno per fare all'Italia?", Meloni apocalittica	1	1
10718	Immigrati, la verità nei numeri: "Crimini 6 volte più di italiani"	1	1
10799	Immigrati, mentre gli italiani non arrivano a fine mese... Quanto paga lo Stato per mantenerli: le cifre-vergogna	1	1
10094	Immigrati, Salvini: "Blindare i confini e più espulsioni. Islam di oggi è un pericolo"	1	1
10163	Immigrati, vergogna italiana: quanti euro guadagnano con la carità (e come li spendono)	1	1
10310	Immigrati: Calderoli, un governo serio fermerebbe invasione clandestini	1	1
10134	Immigrati: Fugatti (Lega), indegno dare case popolari ai profughi	1	1
10716	Immigrazione e stupri, ciò che non vogliono rivelare. Ecco le cifre-choc: perché l'invasione è un pericolo	1	1
10431	Immigrazione in Italia, la verità del super-esperto. Scenario tragico: "Crisi epocale, perché ci rovinano"	1	1
10665	Immigrazione nel caos Gli irregolari in libertà i centri rimpatrio vuoti	1	1
10723	Immigrazione, a cosa vogliono ridurre i nostri militari. Godono le Ong: la legge per farci invadere "meglio"	1	1
10178	Immigrazione, il vescovo Negri: "Rischio eliminazione della società"	1	0
10469	Immigrazione, la lezione della principessa araba senza velo: ecco come ferma l'invasione	1	1
10036	Immigrazione, la profezia-terremoto sull'invasione: "Arriva una nuova ondata", la bomba del big europeo	1	1
10729	Immigrazione, la ricetta di Frattini: "Chiudere i porti"	1	0
10247	Immigrazione, la rotta dei sospetti jihadisti: in Italia su moderni gommoni	1	1
10762	Immigrazione, la vergogna Pd. Lo schifo del paesino invaso: ecco quanti sono i "profughi"	1	1
10259	In Porta Venezia i negozi chiudono per colpa dei profughi	1	1
10550	Isis al centro d'accoglienza. "Tagliare la gola agli italiani": toh, ecco chi finisce in galera	1	1
10148	Italia invasa dai clandestini: ecco perché	1	1
10262	Italia, la terrificante verità sulla mafia nigeriana: la colpa del governo che non si può più tollerare	1	1
10683	Italia, prima gli immigrati: ecco dove gli regaleranno un ristorante e un lavoro	1	1
10400	Italia, vergogna continua. Stop alla nave anti-scafisti, porte aperte ai clandestini: fanno arrivare solo chi ci vuole invadere	1	1
10130	Italia? Immigrati e sfottò: Mr Europa ci rende onore ma non fermerà l'invasione	1	1
10760	Italiani in strada a -20°, loro qui: la villa del Cinquento agli immigrati. Giardini, lusso e sfarzo: ecco le foto	1	1
10078	Iwobi, l'africano leghista che vuole cacciare gli immigrati: "Malaria, morti e... Ecco perché devono stare a casa loro"	1	1
10688	L'accoglienza della 'ndrangheta. "Ai profughi il cibo per i maiali"	1	1
10547	L'Europa caccia i clandestini	1	1
10040	L'Imam di Catania contro i clandestini: "Basta sbarchi, state a casa vostra!"	1	0
10229	Lite fra nomadi alle nozze tra una 14enne e un 15enne: i parenti dello sposo sparano	0	1
10034	Sicurezza, Salvini: "Controllare i centri culturali islamici"	0	1
10000	Immigrazione, il nuovo allarme: sarà una invasione da Marocco ed Egitto, le guerre non c'entrano	0	1
10201	Immigrazione, Viminale: 500 euro a testa ai 13mila profughi per farli uscire dai centri d'accoglienza	0	1
10411	De Falco: «Salgo a bordo con la Ong In missione per salvare i migranti»	0	0
10189	Di Maio: “I campi rom vanno chiusi. Alle europee 5 capilista donne per il M5S”	0	0
10161	Matteo Salvini, i vescovi si convertono sugli immigrati: ha ragione lui, occhio a questi titoli	0	0
10434	Europee, Salvini: "Oggi vero pericolo è terrorismo islamico, non il ritorno del fascismo, nazismo o comunismo"	0	0
10217	Niente più affari con i migranti e adesso cooperative e sindacati scendono in piazza	0	0
10122	Nel Cuneese bambini cattolici e musulmani a scuola di religione insieme	0	0
10530	M5S, Di Maio: "Superiamo i campi rom ma sgomberiamo anche chi occupa abusivamente come CasaPound"	0	0
10527	Di Maio sfida Salvini: sgomberiamo chi non ha diritto, dai rom a CasaPound	0	0
10514	Proteste e urla contro la casa ai rom: “Meglio i migranti degli zingari”	0	0
10582	Inferno-Libia, Tripoli: civili, migranti e rifugiati intrappolati nelle aree dei combattimenti	0	0
10672	De Falco: pronto a imbarcarmi sulla Mare Jonio, riprovevole chi specula sui migranti	0	0
10243	Investe e uccide un migrante in bici, si ferma ma rischia il linciaggio: salvato dalla polizia	0	0
10030	Catania, l'ingegnere "negro" che smonta con i numeri le bufale sui migranti	0	0
10629	Mimmo Lucano e altri 26 a giudizio per gestione migranti a Riace. Processo l'11 giugno	0	0
10181	Mimmo Lucano rinviato a giudizio per la gestione dei migranti a Riace	0	0
10283	Riace, nuovo avviso di garanzia per Mimmo Lucano: truffa e falso ideologico per le case che ospitavano i migranti	0	0
10401	Malta: i 64 migranti della Alan Kurdi smistati in Germania, Francia, Portogallo e Lussemburgo	0	0
10332	Sea Eye, nessun migrante verrà in Italia. ​Li prendono Merkel e Macron	0	0
10789	Sputi e pietre contro mamme e bimbi nomadi: denunciato gruppo di ragazzini	0	0
10626	Trump attacca Ilhan Omar, la prima musulmana in Congresso	0	0
10155	Libia, la rabbia di Matteo Salvini: perché la guerra può far saltare il suo piano sugli immigrati	0	0
10139	Guerra in Libia: aiuti stranieri alle milizie. Continua la battaglia di Tripoli	0	0
10202	Libia, il dossier degli 007: seimila profughi pronti a partire per l’Italia	0	0
10678	Iraq: “Era meglio nei campi profughi”. La gente di Mosul si pente di essere tornata a casa	0	0
10261	La Trenta vuole riaprire i porti: "Dalla Libia rifugiati e non migranti"	0	0
10013	Trenta: «È guerra, i migranti diventano rifugiati e vanno accolti. Alla Lega spiego il diritto internazionale»	0	0
10160	Sarraj: “Ottocentomila migranti pronti a partire per l’Europa e l’Italia”	0	0
10141	Notre Dame, i jihadisti esultano sul web. E sui social monta la tesi del complotto islamico	0	0
10188	Resa dei conti per Alex Belli, Delia attacca Mila: sei musulmana e...	0	0
10186	Minorenni di origine straniera: sono un milione (metà donne) e affrontano discriminazioni per la loro origine	0	0
10635	Saviano "spara" su Notre Dame: "Affannati per la cattedrale, ma ignoriamo i migranti"	0	0
10792	Tutto il mondo è Salone: migranti, sovranismi, Europa, ma anche fiction, fumetti e rap	0	0
10168	Nei quartieri islamici tra collette e sospetti: “La Chiesa ha già i soldi”	0	0
10107	Via Crucis al Colosseo, le meditazioni contestano porti chiusi e lager dei migranti: "Sono i nuovi calvari"	0	0
10294	Migranti, i profughi cantano con Mannoia e Turci: nasce 'We are one' il video dello Sprar	0	0
10794	Barchino di migranti tenta di arrivare a remi in Sardegna	0	0
10303	Firenze, minacciato e offeso dopo aver difeso ragazzo straniero	0	0
10700	Rivoluzione “modest fashion” tra hijab e abaya: il velo islamico diventa un must	0	0
10712	Porti chiusi dal governo? I migranti partiti dall’Algeria continuano a sbarcare in Sardegna	0	0
10597	Lite tra nomadi durante le nozze tra due ragazzini, i parenti dello sposo sparano: accusati di tentato omicidio	0	0
10007	Giovane autistico convinto a sposare una donna straniera per 7mila euro	0	0
10407	Bassetti: "Problema non sono i migranti, ma il lavoro che manca"	0	0
10650	Via Crucis, papa Francesco prega per i migranti: "Porte chiuse per cuori blindati da calcoli politici"	0	0
10663	Sri Lanka, 8 esplosioni in chiese e hotel: 290 vittime, 35 stranieri.   7   kamikaze:  «È terrorismo religioso»	0	0
10674	Attentato Sri Lanka: «Vendetta islamica per i morti in Nuova Zelanda»	0	0
10623	La Cassazione: “I migranti gay vanno accolti se nei loro Paesi sono a rischio”	0	0
10525	Dalla Svezia arriva Izabella, l'anti-Greta Thunberg che si batte contro immigrazione e teoria del gender	0	0
10633	Beppe Grillo al Fatto: "Salvini ministro dell’Interno a sua insaputa. Parla di mafie? No dei migranti"	0	0
10717	Salvini: "90mila i migranti irregolari". E il M5S: "Nel contratto di governo scrisse 500mila"	0	0
10379	Napoli, i migranti cantano "Bella ciao" con de Magistris	0	0
10568	Commento | Crisi libica e profughi, l’Italia è troppo isolata	0	0
10384	Alle celebrazioni per il 25 aprile i giovani immigrati battono gli italiani	0	0
10555	Mafia, Zingaretti: "Appoggio della mafia rom a Salvini sarebbe ennesimo fatto oscuro"	0	0
10598	Migranti, "il governo dell'Ungheria lascia i migranti senza cibo. Qualcuno non ha mangiato per 5 giorni"	0	0
10504	Spari sui migranti in Libia, la testimonianza: "Uomini e donne stavano pregando insieme, poi sono arrivati i soldati"	0	0
10345	Latina, Morra: "Salvini in commissione Antimafia". Sul tavolo i presunti legami tra la Lega e il clan rom Di Silvio	0	0
10578	Papa Francesco dona 500mila dollari a chi ha aiutato i migranti in Messico	0	0
10511	Milano, straniero accecato con lo spray e picchiato: due agenti di polizia a processo	0	0
10080	Libia, Papa: "Evacuare profughi dai centri di detenzione con i corridoi umanitari"	0	0
10368	Il Papa: Libia, corridoi umanitari per i profughi oggi ancora più in pericolo	0	0
10203	Sutera, nel borgo siciliano dell'accoglienza bruciato il pulmino per i migranti: "Clima di odio senza precedenti"	0	0
10284	Il Vangelo è tra i migranti: la Chiesa sale sulla Mare Jonio	0	0
10445	Il Papa bacchetta i sovranisti: ​"Le Nazioni sono fatte dai migranti"	0	0
10450	Maurizio Molinari: "Diseguaglianze e migranti sono il terreno di sfida fra gialloverdi e opposizione"	0	0
10634	Reddito di cittadinanza, superata quota un milione: in testa Campania e Sicilia, gli stranieri sono il 10%	0	0
10615	Decreto sicurezza, stop dei giudici: sì alla residenza per i profughi	0	0
10570	Il mio dialogo con Babis, il sovranista ceco: “Non sono razzista, mi scelgo i migranti”	0	0
10743	Sicurezza, Morra: "Salvini combatta di più la mafia e meno gli immigrati"	0	0
10744	Immigrazione clandestina a Bergamo, le intercettazioni dell'operazione Yuan	0	0
10038	Immigrazione clandestina, arrestati pubblici ufficiali a Bergamo	0	0
10452	Lavoro e immigrazione, drammi di ieri e di oggi	0	0
10689	Biennale di Venezia, arriva dalla Sicilia la barca in cui morirono 700 migranti	0	0
10754	Medico risarcito per il G8:  “I soldi di Salvini per salvare i migranti”	0	0
10435	Il Papa benedice pure le Ong: "Onore a chi accoglie i migranti"	0	0
10113	Roma, rom a Casal Bruciato: nuove proteste per una casa popolare	0	0
10575	Tangenti, Travaglio: "Milano e Calabria? Foto della emergenza italiana: non migranti e altre scemenze ma corruzione"	0	0
10006	I rom hanno diritto alla casa. E i residenti di Casal Bruciato contestano la Raggi	0	0
10173	San Nicola risplenda per i migranti morti in mare, a Bari la benedizione del vescovo è antirazzista	0	0
10244	Roma, la famiglia rom barricata nella casa di Casal Bruciato: "Siamo terrorizzati"	0	0
10652	Casal Bruciato, Raggi: "Famiglia rom ha diritto alla casa: legge si rispetta"	0	0
10752	Genova, in piazza contro i tagli ai fondi per gli hotel aperti ai migranti: ''Intervenga lo Stato''	0	0
10492	Di Maio: diamo il palazzo di CasaPound agli italiani. Sui rom a Casal Bruciato sbagliato schierarsi	0	0
10567	Papa incontra la comunità rom e sinti: 'È cittadino di seconda classe chi scarta altri'	0	0
10690	Libia, Marina salva i migranti. Ira Salvini, scontro con Trenta	0	0
10732	Casal Bruciato, i rom andranno via: "Lasceremo la casa popolare"	0	0
10206	Casa ai rom a Casal Bruciato, primi denunciati per la rivolta	0	0
10228	Paolo Rumiz: "I monaci ricostruirono l'Europa invasa da migrazioni ben più feroci di quelle di oggi" 	0	0
10273	Figli di migranti lanciano l'appello alla politica: "La costruzione di coesione sociale fa bene a tutta l'Italia"	0	0
10049	Conte fa sbarcare i 36 migranti salvati dalla Marina e li ricolloca in Ue. Di Maio: "Problemi si risolvono senza sbraitare"	0	0
10662	Altaforte e il Primato Nazionale: quella rete di destra che inquina il dibattito anti immigrati sui social media 	0	0
10523	Salone del libro, Pif: "L'immigrazione? Per molti di sinistra è solo uno che ti vende le calze"	0	0
10485	Mare Jonio, applausi a Lampedusa per lo sbarco dei migranti: nave sequestrata	0	0
10338	Mare Jonio, Conte: "Con Salvini siamo d'accordo sul sequestro. I migranti verranno fatti scendere"	0	0
10329	Mare Jonio, applausi a Lampedusa per lo sbarco dei migranti: nave sequestrata	0	0
10059	Torre Maura, 41 denunciati per le proteste anti nomadi: apologia fascismo e istigazione odio razziale	0	0
10156	Giro di vite su migranti e norme “spazza clan”: ecco il “decreto Sicurezza bis”	0	0
10253	Settanta migranti intercettati e recuperati a largo di Lampedusa	0	0
10581	Decreto sicurezza e multe a chi soccorre i migranti: solo un annuncio	0	0
10638	Europe Talks - Tra migranti e Russia, oltre 200 cittadini a Bruxelles per discutere il futuro dell'Europa	0	0
10447	Patricia Janet Scotland: “Clima e migrazioni sono connessi. Ci salverà il commercio globale”	0	0
10115	Napoli, i ragazzi di Scampia in scena su un barcone come i migranti	0	0
10703	Migranti, Corte Giustizia Ue: "Vietato il rimpatrio di migranti a rischio soprusi. Anche se non hanno protezione"	0	0
10741	Ramadan, Trump esclude i musulmani americani da cena alla Casa Bianca	0	0
10545	Merkel chiude alla Lega nel Ppe: «Noi diversi da Salvini, a partire dai migranti»	0	0
10176	Sicurezza e migranti, se la Ong sbaglia paga il comandante	0	0
10172	Elezioni Ue, i candidati alla presidenza della Commissione a confronto: ecco le idee su economia e immigrazione	0	0
10112	L'italiana "giovane europeo" dell'anno si batte per i diritti dei migranti: "Europe Talks ci aiuta a dialogare" 	0	0
10782	Carceri, meno reati ma aumentano i detenuti e le pene sono più lunghe. In calo gli stranieri. Affollamento al 120%	0	0
10698	Proteste e disordini anti-nomadi a Roma, 65 indagati di Casapound e Forza Nuova	0	0
10109	Roma, 65 indagati di Casapound e Forza Nuova per disordini contro rom	0	0
10528	Il messaggio di Sala a Salvini: "Sui migranti un po' di cuore in più non guasterebbe"	0	0
10556	Roma, 65 indagati di CasaPound e Forza Nuova per “odio razziale” contro i rom di Torre Maura	0	0
10746	Jungle Europa: immigrazione, l'emergenza è la mortalità in mare	0	0
10145	Meno ricongiungimenti familiari e più competenze, l’America si sceglie i suoi immigrati	0	0
10781	L'età fragile', tra i migranti che compiono 18 anni dopo il Decreto sicurezza: "Si vanifica la nostra integrazione"	0	0
10376	Beppe Sala sbarca a New York e attacca i Salvini "immigrati"	0	0
10777	Sea Watch: «Via libera allo sbarco delle famiglie migranti a Lampedusa»	0	0
10353	Moni Ovadia a Parma: "Sovranismo? L'Italia in un secolo ha avuto 30 milioni di emigranti"	0	0
10233	Malta, due militari accusati di omicidio razziale: spari ai migranti «solo perché sono neri». Un morto e due feriti	0	0
10707	Sea Watch, Finanza sequestra la nave: sbarcano i migranti	0	0
10436	Sea Watch, Salvini apprende in diretta tv dello sbarco dei migranti: "Procuratore vuole fare il ministro"	0	0
10085	Sea Watch, il pm fa sbarcare i migranti. Salvini: denuncio chi ha aperto i porti	0	0
10044	Il pm fa sbarcare i migranti Il capo leghista smentito in tv	0	0
10602	Pisa, il poster di Salvini con i migranti fatto dagli studenti, Ceccardi: «Va rimosso»	0	0
10193	Sea Watch e lo sbarco del migrante con una sola gamba: ''Che possa realizzare i suoi sogni''	0	0
10282	Decreto Sicurezza Bis, multe più salate per chi soccorre i migranti	0	0